"ID","Work Item Type","Title","Assigned To","State","Tags","Description"
"","Epic","DOC-2: DOCUMENTATION","","To Do","documentacion; Must","EPIC: E3 — DOCUMENTATION. Agrupa las historias de usuario y tareas del área de documentación del MVP (2 sprints)."
"","Issue","DOCH01: Arquitectura documentada","","To Do","arquitectura; sprint-1; DOCH01; Must","Como evaluador, quiero la arquitectura del sistema documentada, para entender cómo está construido."
"","Task","DOCF001: Diagramas de despliegue y componentes","","To Do","arquitectura; sprint-1; DOCF001; Must","Diagrama de despliegue mostrando el cliente, el punto único de entrada al sistema, los distintos servicios internos que componen el backend, y los servicios externos (identidad, almacenamiento de estado compartido). Diagrama de los componentes que conforman cada servicio. Tabla de tecnologías con su justificación."
"","Issue","DOCH02: Acceso y comunicación documentados","","To Do","acceso-y-salas; sprint-1; DOCH02; Must","Como evaluador, quiero el flujo de acceso y comunicación documentado, para entender cómo opera el tiempo real."
"","Task","DOCF101: Secuencia de acceso y contrato de eventos","","To Do","acceso-y-salas; sprint-1; DOCF101; Must","Diagrama de secuencia del flujo completo de acceso (identificación, conexión, creación/unión a sala). Tabla con el contrato de todos los eventos en tiempo real: nombre, dirección, datos que transporta y propósito."
"","Issue","DOCH03: Motor del juego documentado","","To Do","motor; sprint-1; DOCH03; Must","Como evaluador, quiero el motor del juego documentado, para entender la lógica del dominio."
"","Task","DOCF201: Diagrama de clases del motor y de fases","","To Do","motor; sprint-1; DOCF201; Must","Diagrama de clases con las entidades principales del dominio (sala, tablero, barco, jugador, equipo, poder, motor de juego). Diagrama de la máquina de fases de la partida."
"","Issue","DOCH04: Concurrencia documentada","","To Do","concurrencia; sprint-2; DOCH04; Must","Como evaluador, quiero el manejo de concurrencia documentado, para evidenciar cómo se resuelve el principal reto técnico del proyecto."
"","Task","DOCF301: Diagramas de secuencia de la ronda simultánea y la ventana de reacción","","To Do","concurrencia; sprint-2; DOCF301; Must","Diagrama de secuencia de la ronda de disparo simultáneo, mostrando cómo se resuelve la exclusión entre disparos concurrentes a la misma casilla. Diagrama de secuencia de la ventana de reacción, mostrando su apertura, posible anulación y cierre."
"","Issue","DOCH05: Documentación de cierre y demo","","To Do","cierre; sprint-2; DOCH05; Must","Como evaluador, quiero la documentación de cierre del proyecto, para poder reproducir la demo y conocer su evolución prevista."
"","Task","DOCF401: Manual de demo y visión de evolución futura","","To Do","cierre; sprint-2; DOCF401; Must","Manual paso a paso para reproducir la demostración. Documentación de la visión de evolución del sistema más allá del MVP."
