"ID","Work Item Type","Title","Assigned To","State","Tags","Description"
"","Task","UIUXF1201: Pantalla de victoria + manejo visual de errores y desconexiones","","To Do","pulido; sprint-2---mecanicas,-observabilidad-y-cierre; UIUXF1201; Must","Pantalla de victoria y manejo de errores: componente <Victoria ganador={equipo}/> con animacion y boton 'Volver al lobby'. Componente <ErrorBanner/> que escucha eventos 'error:*' y muestra mensajes claros (conexion perdida, sala llena, etc). Overlay de reconexion: si se pierde el socket, mostrar 'Reconectando...' e intentar reconexion automatica con el token."
"","Epic","DOC-2: DOCUMENTATION","","To Do","documentacion; Must","EPIC: E3 — DOCUMENTATION. Agrupa las historias de usuario y features de esta area del MVP (2 sprints)."
"","Issue","DOCH01: Como evaluador, quiero la arquitectura documentada, para entender el sistema.","","To Do","arquitectura; sprint-1---cimientos,-conexion-y-core; DOCH01; Must","Como evaluador, quiero la arquitectura documentada, para entender el sistema."
"","Task","DOCF001: Diagramas de despliegue, componentes general y tabla de tecnologias","","To Do","arquitectura; sprint-1---cimientos,-conexion-y-core; DOCF001; Must","Diagramas de arquitectura (formato Mermaid en la Wiki de Azure): (1) Diagrama de despliegue: Cliente[React/Vercel] -> Servidor[Node/Render] -> Redis[Upstash] + Google OAuth. (2) Diagrama de componentes del servidor: auth, rooms, game-engine, state-manager, salva-handler. (3) Tabla de tecnologias con justificacion (Node, Socket.io, Redis, React). Exportar a la Wiki."
"","Issue","DOCH02: Como evaluador, quiero documentado el acceso y la comunicacion, para entender el tiempo real.","","To Do","acceso-y-salas; sprint-1---cimientos,-conexion-y-core; DOCH02; Must","Como evaluador, quiero documentado el acceso y la comunicacion, para entender el tiempo real."
"","Task","DOCF101: Secuencia de login OAuth y contrato de eventos Socket.io","","To Do","acceso-y-salas; sprint-1---cimientos,-conexion-y-core; DOCF101; Must","Diagrama de secuencia del acceso (Mermaid sequenceDiagram): flujo completo login OAuth -> JWT -> conexion socket -> crear/unir sala. Mas el contrato de eventos Socket.io documentado en tabla: nombre evento, direccion (cliente->servidor o broadcast), payload, descripcion. Incluir TODOS los eventos: auth, room:create, room:join, disparo:realizar, salva:inicio, salva:disparo, sala:estado, etc."
"","Issue","DOCH03: Como evaluador, quiero el motor documentado, para entender la logica del dominio.","","To Do","motor; sprint-1---cimientos,-conexion-y-core; DOCH03; Must","Como evaluador, quiero el motor documentado, para entender la logica del dominio."
"","Task","DOCF201: Diagrama de clases del motor y maquina de estados de la sala","","To Do","motor; sprint-1---cimientos,-conexion-y-core; DOCF201; Must","Diagrama de clases del motor (Mermaid classDiagram): clases Sala, Tablero, Barco, Jugador, Equipo, Poder, GameEngine y sus relaciones. Mas la maquina de estados de la sala (Mermaid stateDiagram): LOBBY -> COLOCACION -> TURNOS <-> SALVA -> FIN, con las transiciones y condiciones de cada cambio."
"","Issue","DOCH04: Como evaluador, quiero la concurrencia documentada, para evidenciar el reto principal.","","To Do","concurrencia; sprint-2---mecanicas,-observabilidad-y-cierre; DOCH04; Must","Como evaluador, quiero la concurrencia documentada, para evidenciar el reto principal."
"","Task","DOCF301: Diagrama de secuencia de la Salva (exclusion mutua) y de la Contramedida","","To Do","concurrencia; sprint-2---mecanicas,-observabilidad-y-cierre; DOCF301; Must","Diagramas de secuencia de las mecanicas de concurrencia (Mermaid): (1) Salva Simultanea: varios clientes emitiendo 'salva:disparo' a la vez, el servidor serializando en cola, el lock por casilla (GETSET), y el broadcast del resultado. (2) Contramedida: ventana de 5s, el defensor reaccionando, la anulacion del poder y devolucion de energia. Este es el diagrama clave que evidencia el reto de ARSW."
"","Issue","DOCH05: Como evaluador, quiero la documentacion de cierre, para reproducir la demo y conocer la evolucion.","","To Do","cierre; sprint-2---mecanicas,-observabilidad-y-cierre; DOCH05; Must","Como evaluador, quiero la documentacion de cierre, para reproducir la demo y conocer la evolucion."
"","Task","DOCF401: Manual de demo + documentacion de evolucion a microservicios (Fase 2)","","To Do","cierre; sprint-2---mecanicas,-observabilidad-y-cierre; DOCF401; Must","Manual de demo (paso a paso para la presentacion): como crear sala, como invitar jugadores, como abrir varias salas en paralelo, como disparar la Salva. Mas documentacion de evolucion a Fase 2: diagrama de la arquitectura objetivo con microservicios + API Gateway + gRPC, explicando que se separaria (auth, game, matchmaking) y por que."
